{
  "$schema": "https://json-schema.org/draft/2020-12/schema",
  "$id": "https://github.com/pragmaconflux/titan1/schemas/titan-plugin-manifest-v1.0.schema.json",
  "title": "Titan Plugin Manifest v1.0",
  "type": "object",
  "additionalProperties": false,
  "required": [
    "schema_version",
    "id",
    "name",
    "version",
    "api_version",
    "entry_point",
    "capabilities"
  ],
  "properties": {
    "schema_version": {
      "const": "1.0"
    },
    "id": {
      "type": "string",
      "pattern": "^[a-z][a-z0-9]*(?:[._-][a-z0-9]+)*$",
      "maxLength": 128
    },
    "name": {
      "type": "string",
      "minLength": 1,
      "maxLength": 128
    },
    "version": {
      "type": "string",
      "pattern": "^(0|[1-9]\\d*)\\.(0|[1-9]\\d*)\\.(0|[1-9]\\d*)(?:-[0-9A-Za-z-]+(?:\\.[0-9A-Za-z-]+)*)?(?:\\+[0-9A-Za-z-]+(?:\\.[0-9A-Za-z-]+)*)?$"
    },
    "api_version": {
      "type": "string",
      "pattern": "^(0|[1-9]\\d*)\\.(0|[1-9]\\d*)(?:\\.(0|[1-9]\\d*))?$"
    },
    "entry_point": {
      "type": "string",
      "pattern": "^[A-Za-z_][A-Za-z0-9_.]*:[A-Za-z_][A-Za-z0-9_]*$"
    },
    "capabilities": {
      "type": "array",
      "minItems": 1,
      "uniqueItems": true,
      "items": {
        "enum": [
          "decoder",
          "analyzer",
          "detection",
          "report"
        ]
      }
    },
    "description": {
      "type": "string",
      "maxLength": 2048
    },
    "author": {
      "type": "string",
      "maxLength": 256
    },
    "license": {
      "type": "string",
      "maxLength": 128
    },
    "homepage": {
      "type": "string",
      "maxLength": 512
    },
    "permissions": {
      "type": "array",
      "uniqueItems": true,
      "items": {
        "enum": [
          "filesystem.read",
          "filesystem.write",
          "network",
          "configuration"
        ]
      }
    },
    "dependencies": {
      "type": "object",
      "propertyNames": {
        "pattern": "^[a-z][a-z0-9]*(?:[._-][a-z0-9]+)*$"
      },
      "additionalProperties": {
        "type": "string",
        "maxLength": 128
      }
    }
  }
}
