{
  "schema_version": "1.0",
  "id": "example.summary",
  "name": "Summary Report",
  "version": "1.0.0",
  "api_version": "1.1.0",
  "entry_point": "plugin:SummaryReport",
  "capabilities": ["report"],
  "description": "Example report plugin: contributes a summary section to case reports.",
  "author": "Titan examples",
  "license": "MIT",
  "permissions": [],
  "dependencies": {}
}
